text,label,여성/가족,남성,성소수자,인종/국적,연령,지역,종교,기타 혐오,악플/욕설,clean
한남에서 소신투표하는 한국남자강동원,0,0.05,0.94,0.02,0.05,0.03,0.03,0.02,0.02,0.05,0.05
2번남들 부들대는게 보기 재밌긴한데 ㅋㅋ 헤테로 한남녀들의 싸움이라 뵈지도않고 모여도 한줌도안되는 성소숫놈1은 에헤이 그려 느그들 잘들놀아라잉 하고 소신투표나할게,0,0.06,0.94,0.03,0.07,0.03,0.02,0.02,0.02,0.05,0.04
이재명 고려하고 있는 이유는 간단함 한남충과 반대로 가기 위해서임 그들에게 제일 좆같은 한 표를 선사하고 싶음 전에는 한남들이 윤 싫다고 갈팡질팡하길래 나는 소신투표 하려고 했는데 지금은 헤헷 여가부 폐지해주신댕 여자들 심이나 안 뽑으라고 밭갈러 가장 ㅎ 이러고 있어서 마음이 흔들림,0,0.06,0.93,0.02,0.05,0.03,0.02,0.02,0.02,0.04,0.04
하 소신투표 할라고 진짜 맘 먹었었는데 나라가 왜 이 모양이 됐냐 눈물난다 어디 해보자고 니가 대통령이 되나 한남 중의 한남 새끼야,0,0.03,0.93,0.02,0.05,0.03,0.02,0.02,0.02,0.05,0.04
윤석열이 당선되도 소신투표 주장하는 사람들은 왜 거의 다 한남들이냐,0,0.06,0.93,0.02,0.02,0.03,0.03,0.02,0.02,0.05,0.04
최소한 여성분들 지금의 생활을 유지하려면 찢을 뽑아야 합니다 한남들 지금 여기저기에 소신투표하라고 하는데 표 갈리게 해서 윤석열 뽑히게 하려고 그런 겁니다 찢 뽑는 것도 소신이라면 소신입니다 한남 뜻대로 못하게 하려는 투표,0,0.06,0.93,0.02,0.04,0.03,0.02,0.02,0.02,0.05,0.04
한남충들이 여초 커뮤 들어가서 소신투표하자며 이재명 안 뽑게 선동해서 윤 되게 하려는 거 보고 그냥 이재명 뽑기로 했음 내 손으로 이 인간 뽑는다는 게 존나 싫지만,0,0.05,0.93,0.02,0.03,0.05,0.02,0.02,0.02,0.05,0.04
자지새끼들 성상납준석 존나 부둥부둥해주더라 ㅋㅋㅋㅋㅋㅋㅋ 난 가세연이 이준석 성상납 폭로했을때 그나마 나라에 희망이 있는줄 알았어 ㅋㅋㅋㅋㅋㅋ 근데 윤석열이 그거 알고도 이준석 선거캠프에 다시 들임 ㅋㅋㅋㅋ 여기서 그냥 더이상 흐린눈 못하고 소신투표로 갈아탔다,0,0.03,0.93,0.03,0.05,0.04,0.02,0.02,0.03,0.05,0.03
난 전략맞음 입찢어져도 1번이 소신투표될순없어나한텐ㅋㅋㅋ 망할2번남들,0,0.03,0.92,0.03,0.05,0.03,0.03,0.01,0.02,0.05,0.04
아직도 소신투표 타령하는거 솔직히 존나 짜증난다 소신투표의 결과가 여자표 무시하는거잖아 한남들이 분탕치나 싶을 정도임 하 진짜로 윤 당선될까봐 하루하루가 스트레스다,0,0.06,0.92,0.02,0.02,0.04,0.02,0.02,0.02,0.06,0.04
한남들은 소신투표가 아니라 전략투표로 이재명을 뽑아서 여성인권과 페미의 입지가 넓어지는 걸 더 무서워하는구나 #추적단불꽃 박지현 킹메이커,1,0.1,0.91,0.02,0.03,0.02,0.02,0.02,0.02,0.04,0.04
이재명이 지금의 부인 김혜경에게 프로포즈하며 보여준 일기장 낮에 옥상에서 노는데 그년이 기도횐가 뭔가 하는 데서 어떤 남자애와 아주 다정히 얘기하고 있었다 그X은 어떤 남자와 난잡한 관계여서 난 생각을 바꾸고 눈물을 뿌리면서 돌아섰다 이런 한남에게 소신투표,1,0.07,0.91,0.02,0.04,0.02,0.02,0.02,0.02,0.07,0.06
안그래도 지금 이 순간에도 소신투표할까 한남들 표를 내 표호 상쇄해야 하나 고민중이라 심란한데 더 심란하게 맹글고있어,0,0.05,0.91,0.02,0.03,0.03,0.03,0.01,0.01,0.05,0.05
진짜 정치 한남들 ㅈ같아서 소신투표도 못하겠다,0,0.05,0.91,0.02,0.03,0.04,0.02,0.02,0.02,0.06,0.04
이번 선거에서 한남의 소신투표는 정당화될 수 없다고 생각해요,1,0.05,0.91,0.02,0.04,0.02,0.02,0.02,0.02,0.05,0.06
얘들아기억하자 소신투표안된다 나도심이좋지만지금은아님 이대남들이지랄발광여가부폐지에북다닥달려들어서쿰척거리고있으니윤만큼은막아야한다최악을막자,0,0.08,0.9,0.04,0.03,0.02,0.02,0.01,0.03,0.06,0.04
걍 표분산 되는 게 윤석열 지지하는 펨코야갤 한남충들이 젤 원하는 건데 왜 아직까지도 여자들은 소신투표하는지 모르겠음,0,0.12,0.9,0.02,0.02,0.04,0.02,0.02,0.02,0.04,0.05
응소신투표할때가아니야 2제명 안 뽑으면 펨코남들의 시대가 온다고,0,0.04,0.9,0.08,0.06,0.02,0.02,0.01,0.02,0.05,0.06
윤 이 둘다 싫어서 소신투표하거나 표 던질랬는데 생각해보니 그러면 표 분산돼서 윤 당선임ㅋㅋㅋㅋㅋㅋㅋ 당연함 온 커뮤 한남들은 무조건 윤 한명만 미니까 심지어 신천지라며 신천지 신도 10만이라던데 ㅈ같아도 참고 여자들도 표 몰아야함,0,0.09,0.9,0.02,0.03,0.04,0.02,0.02,0.03,0.04,0.03
이재명 아들이 친할머니 발인 다음날 시발 내상 입었다 는 은어가 섞인 성매매 업소 후기를 작성했는데 후에 문제가 터지자 이재명은 아들이 성매매 업소 후기를 작성한 것은 사실이나 성매매는 안했다 는 말을 한다 이재명에게 소신투표하면 한남들 업소후기 써놓고 성매매는 안했다고 구라질 깜,0,0.05,0.9,0.02,0.03,0.04,0.02,0.01,0.02,0.06,0.04
남초 한남들 여자들 표 분신시키려고 여자인 척 여초 커뮤 들어가서 이재명도 윤석열도 다 쓰레기니까 소신투표 심상정 찍자고 하고 다니는구나 여자들이 뭔 아메바 단세포 무지능인 줄 아네 어쩜 이렇게 예상을 안 벗어나냐,0,0.09,0.9,0.02,0.03,0.04,0.02,0.02,0.02,0.05,0.03
소신투표 해봤자 이대녀들의 표는 유의미하게 받아들여지지 않고 그들에게는 어 이대녀들 소수정당으로 표분산돼서 힘못쓰네 무시해도 되겠네 로 해석됨 왜냐면 한남들은 바퀴벌레떼같이 여혐공약 에 이끌려서 개같이 2번에 몰표찍으니까 걔네 비위를 맞추는게 이득이거든ㅋㅋ,0,0.14,0.89,0.02,0.04,0.02,0.02,0.01,0.02,0.04,0.03
원래 죽어도소신투표ㅇㅇ sj sj pump this party엿는데 박지현님 입당기사 보자마자 흔들렷어 저두욧 n번방에 엮인 한남들 오지게많고 뭐만하면 성적으로 보복시킬려고 혈안인 놈들인데 신상 얼굴 공개하고 정치판에 뛰어든게 얼마나 큰 결심이었을지 상상이 x 게다가 성착취,0,0.03,0.89,0.03,0.03,0.03,0.01,0.01,0.02,0.08,0.05
윤의 지지율이 이렇게까지 높아질 거라고는 생각도 못하고 소신투표 하겠다 장담했었는데 아무래도 이건 아니다 윤이 되면 정말 여자들 다 죽어나가고 여자들 죽인 자댕이들은 더 활개치며 처벌도 안받고 돌아다닐거다 진짜 이렇게까지 지지율이 높을 줄이야 사실은 비상식적인게 상식인거 아닐까,0,0.13,0.89,0.03,0.04,0.02,0.01,0.02,0.02,0.06,0.03
주4일제에 혹해서 심뽑을까 했던 사람인데 이번엔 진짜 안된다는 걸 깨달았음 심상정 뽑으면 심상정이 된다 내가 소신투표하면 국가가 알아줄 것 이라는 순진한 기대 하지마세요 당장 이대남새끼들도 무지성으로 윤석열 뽑아서 지금 이 지랄 난거임ㅋㅋ 우리도 무지성으로 윤석열 막아야 삽니다,0,0.04,0.89,0.03,0.12,0.03,0.03,0.01,0.05,0.05,0.03
소신투표도 지금 윤석열이 낙선했을때나 통하는 말이지 윤석열 대통령되면 야갤펨코인셀한남들의 나라 되는거 머지 않았다니까요 진짜 아직도 심뽑심하는거 답답해죽을거같음 당장 펨코에서도 여자들 표 분산시킨다고 심블리 영업하라하는데,0,0.11,0.88,0.02,0.03,0.03,0.02,0.01,0.02,0.05,0.06
걍 저벅저벅걸어가서 민증보여주고 소신투표하고나올 정상인이 많지가않네 자캐풀 되돌아봄 다음 기회엔 꼭 정상인을 2년후 자캐출마합니다,0,0.05,0.88,0.02,0.04,0.02,0.02,0.01,0.02,0.07,0.05
전략 투표 했을땐 배은망덕한 냄저대통령은 먹버하고 소신 투표 했을땐 무지개 쓰까가 원한적 없는 트젠까지 데리고 와서 절대 안믿음 앞에서 말 안믿고 뒤에서 무슨 생각하고 있을까 계산기 두드리고 있음 어차피 나한텐 둘다 리스크인데 더 리스크가 적은 쪽으로 뽑을 거임,0,0.02,0.87,0.23,0.04,0.05,0.03,0.02,0.04,0.04,0.03
그거죠 이래도 소신투표할래 이런 느낌 물론 그 의도가 아니라 오메가남들 굳히려고 그러는거겠지만,0,0.07,0.85,0.04,0.03,0.02,0.02,0.01,0.02,0.08,0.07
#여성이 뽑는다 여성이 바꾼다 신남연들이랑 인셀 펨코남들이 이재명싫어하는것만 봐도 답나오잖아 이재명 찍어야함 소신투표도 그 소신이 효과가 있어야 소신투표를 하지 곧 대선 앞 두고 지지율바닥인 사람왜뽑냐 누군 이재명 좋아서 뽑는줄아나 현실적으로 생각하자,0,0.16,0.84,0.02,0.06,0.02,0.02,0.01,0.02,0.04,0.06
심상정 소신투표 한다는 사람들 소신대로 투표할수있는 그 소신이 ㅋㅋ 부럽네 어디 한남없는 해외나가사나 소신대로 여자들이 심뽑으면 윤석열이 2030눈치볼거라는 그 지능도 부럽고 당장 대한민국에서 살아남아야하는 20여자인 나는 저런 속편한소리보면 진짜 답답해 죽을거같은데,0,0.19,0.83,0.01,0.06,0.02,0.02,0.01,0.02,0.05,0.04
이삼남들이 윤석열 이준석 미친듯이 지지하는거 보면 모르냐고 진짜 미쳐버리겠네 윤석열되면 이삼남들 눈벌게져서 맘편하게 죽일여자들 찾아다닐텐데 누군 소신투표 안하고 싶냐고 이재명뽑겠다는 여자들 멍청해서 뽑겠다는거 아니라고 지금 심찍으면 이삼남한테 보여주는거라고 여자표 의미없다는거,0,0.17,0.83,0.02,0.05,0.01,0.01,0.01,0.02,0.07,0.04
소신투표라니 지금 그런걸 할 여유가 잇냐고 벌건당 및 한남 막는걸로도 벅찬대 여기서 흩어지면 대한민국 여성인권 망할게 뻔할걸 모르는거야 저딴 놈들 활개치게 냅둘거냐고 지금 당들이 균형잇게 경쟁하는것도 아닌데 소신투표 한다는건 걍 배부른소리같아,0,0.11,0.82,0.02,0.03,0.02,0.01,0.01,0.02,0.09,0.04
님들아 제발제발 무지성 아묻따 2찍는 신남연 새끼들 막아야 함 소신투표한다 눈물이 난다 그치만 이해함 전략투표한다 눈물이 난다 우리 존재 파이팅 투표를 아예 안 한다 이런 사람은 없겠지만 한 대 쥐어박고 싶어지기 전에 당장 신분증 들고 사전투표 장소로,0,0.16,0.8,0.04,0.06,0.02,0.07,0.01,0.03,0.04,0.03
윤석열은 저렇게 인셀남들 표심 다닥다닥 긁어모아서 원기옥 만드는데 진짜로 뭐 똑똑한척 난 고고한 소신투표하겠다 이재명도 똑같니 뭐니 눈가리고 아웅하는게 페미니즘이냐 발등이 아니라 콧등에 불떨어져도 지 코가 타는지도 모르는 못난 멍청이들,0,0.12,0.8,0.02,0.03,0.02,0.01,0.01,0.03,0.1,0.04
님들아 제발제발 무지성 아묻따 2찍는 신남연 새끼들 막아야 함 소신투표한다 눈물이 난다 그치만 이해함 전략투표한다 눈물이 난다 우리 존재 파이팅 투표를 아예 안 한다 이런 사람은 없겠지만 한 대 쥐어박고 싶어지기 전에 당장 신분증 들고 사전투표 장소로,0,0.16,0.8,0.04,0.06,0.02,0.07,0.01,0.03,0.04,0.03
윤이 된다 민주당 새끼들 악에 받쳐 저주 뇌절함 예상가능 그렇다고 국힘이 지엄한 소신투표자들의 뜻을 삼가 모시나 역시 한녀들은 전략투표할 능지조차 안된다며 조롱하고 난리남 나라꼴 은 장담할수 없지만 한남 새끼들이 기세등등해서 체감 여권은 ㅈ창남,0,0.3,0.79,0.01,0.04,0.02,0.02,0.01,0.02,0.04,0.03
소신투표 하세요 그래서 이번에 윤석열 이지만 다음엔 이준석이 장관 총리찍고 차차기 대권 유력주자로 인셀남들의 열렬한 지지로 청와대에 입성하는 끔찍한 미래를 맛볼수 있습니다 당장은 여성인권뿐이지만 어린이 노인 장애인 등 모든 약자들에 대한 혐오도 강해질겁니다,0,0.07,0.79,0.04,0.07,0.02,0.01,0.01,0.03,0.04,0.09
소신투표 하고 싶었지만 그럴 상황이 아닌 것 같음 시발 설마 이 정도까지 시대가 퇴화될 줄 누가 알았겠냐 쉰남연 같은 놈들이 나대는 꼴 절대 못 본다,0,0.06,0.79,0.04,0.25,0.19,0.05,0.01,0.04,0.02,0.02
희대의 신조어 이번남 을 본 뒤 가벼운 마음으로 소신투표 하고 옴 윤이 대통령 되면 다 이번남들 때문이것지 윤이 대통령이 돼도 한 번 이번남은 영원한 이번남일 테니 이걸로 됐다,1,0.03,0.78,0.02,0.03,0.01,0.03,0.01,0.02,0.09,0.17
소신투표로 골머리 싸매는 거 보니까 존나 재밌음 왜 재밌냐고 내가 이낙연 찍어달라고 할 때 개무시하던 새끼들 엿먹고 있어서 ㅎㅎ 응 니들이 자초한 개쓰레기 최악의 대선이야 니들이 팔자 좋게 애미추 찍다가 이 꼬라지 났는데 누굴 탓함 알아서 잘 살아 나는 삼씹남이라 걱정 ㄴㄴ,0,0.07,0.77,0.01,0.04,0.05,0.02,0.01,0.02,0.1,0.03
핸냄들 기세등등은 유구한 역사고 트위터에서나 불붙어서 싸우지 다른 곳으로 눈 돌리면 여전히 페미는 정신병 취급을 받고 있다 대통령이 바뀐다고 내 삶이 미라클하게 나아진 적도 없으니 그냥 소신 투표 할 거임,0,0.35,0.75,0.02,0.03,0.02,0.01,0.01,0.02,0.04,0.03
아 나도ㅋㅋㅋ어제 시전투표하러 갔는데 젊어보이는 남자들 전부 2번남같이 생겨가지고ㅋㅋㅋㅋ어휴 꼴에 소신투표하겠다고 집밖으로 나왔나보다 싶었는데ㅋㅋㅋㅋㅋ,0,0.08,0.74,0.02,0.01,0.06,0.01,0.01,0.03,0.12,0.07
진짜 이번남 존나많음 여성 여러분들 꼭 투표하세요 전략투표든 소신투표든 꼭 해주세요,1,0.1,0.73,0.02,0.01,0.02,0.02,0.01,0.02,0.09,0.1
ㅇㅈㅁ이 대통령 안되면 그 책임이 소신투표에 있다는 비난은진짜 이해 안됨 그남들 표는 어차피 버린다고 생각해서 여자만 욕한다 거기에 무슨 정의가 있나요 표 결집을 원한다면 강요비난하지 말고 설득하세요,0,0.11,0.72,0.04,0.01,0.01,0.02,0.01,0.02,0.11,0.1
소신투표 하고 싶었는데 펨코남들이랑 윤지지자들이 발악하는거보니까 어케든 윤 막을려고 이 찍어야할거같음,0,0.07,0.69,0.05,0.17,0.01,0.01,0.01,0.02,0.07,0.06
소신투표를 뭐라 할 순 없는 입장이지만 양당제인 이상 정권은 강자의 손만 들어줍니다 2번이 당선되는 순간 2번의 주요 지지층인 20대 펨코남들에게 주도권이 쏠리게 됩니다 부탁드려요 나라를 망칠 수는 없잖아요,0,0.04,0.68,0.03,0.18,0.02,0.02,0.0,0.01,0.04,0.1
허구헌날 죽어나가던 20대여성이 이번 선거에서는 아주 중요한 사람들이 되었네 다행이긴 하다 그러나 구호는 구호일 뿐 실체와 행동이 중요한데 잘못했다고 했잖아 씨발년아 하고 하던짓 더 하는 한남에게 당해본 적이 있어서 잘 안믿김 40 50 한녀들보다 훨씬 똑똑하니까 소신투표 하세요,0,0.45,0.68,0.01,0.03,0.03,0.01,0.01,0.02,0.05,0.04
제가 자캐로 만화를 그려서 타장 ex 뜰팁 비율이 우주끝까지 소신투표해주세요,0,0.04,0.68,0.02,0.04,0.01,0.02,0.01,0.01,0.11,0.15
자꾸 1에 속지말라는 말들이 있으나 후보에 그성별중 쓰레기 아닌 사람이 어디있을것이야 소신투표했다가는 나중에 소신투표 기회조차 사라질 것 같고요 그러니까 시발 그남만큼은 막아야 하 누가 모르냐 1도 쓰레긴거ㅋㅋㄱㄱㅋㅋㅋㄱ,0,0.01,0.67,0.06,0.02,0.02,0.04,0.01,0.04,0.25,0.04
나는 아직 1번을 해야할지 3번을 해야할지모르겠다 나는 늘 소신투표파라 3번분에게 5 이상 달성하겠끔도와주고 싶은데 그남들이 원하는 2번을 하게해주고 싶지않아 진짜 나라망해 그나마 1번 조직에 괜찮으신분이 들어가서 여성정책은 괜찮은편인데,0,0.13,0.63,0.02,0.02,0.01,0.02,0.01,0.01,0.07,0.16
젊은 한녀들은 너무 순진해서 언제 보답받을지도 불투명한 소신투표에 대한 국가의 응답 을 기다리면서 심상정 뽑는다고 할때 한남충들은 표분산으로 윤석열을 당선시키기 위해 심상정 뽑는 여자들을 부추기고 있음 이게 뭘 시사하는지는ㅋㅋ,0,0.55,0.61,0.02,0.03,0.03,0.02,0.01,0.02,0.03,0.04
